{
  "schemaVersion": 2,
  "task": "SEC-02",
  "detectorPolicySha256": "56821eb657093c79b26f088c61458a0d6a20e5e3353d04556970b1f3ba11fe6a",
  "reviewPolicySha256": "15a8b6292c825fbe6bd4ba98b6b96e459ba66bf7b3c7aadc8206f94db372e95e",
  "dialectCheckerSha256": "30a70a1a4263c1451c584c95d4f226f1939a46cbf3081faa3144925d225a477b",
  "dialectPolicySha256": "e71e8be1b0a4220a50275bb6e88ead58e82f610dade5bd5c53e6242df7c4d769",
  "dialectImportSetSha256": "8ea47194c4812395fcd616435150a0a9a456fff64b426f3711664b8054916ce5",
  "runtimeSinkSetSha256": "42bc1e83f89fab7c89e4121271ad8da7d6c5b8bcafa115824d4775e6c327850c",
  "sourceClosure": {
    "domain": "mini-lux/sec02/restricted-runtime-dialect/v1",
    "executableFileCount": 100,
    "executableManifestSha256": "96cf0756860cb478c2ddddadbeef0cc54cd9b7b0f2e5925554efb13962f6a200",
    "dialectImportCount": 36,
    "dialectExceptionCount": 2
  },
  "files": [
    {
      "sourcePath": "electron/ipc-contract.cjs",
      "bytes": 6394,
      "sha256": "44ace7828e8eaf6de5b15822b3c991e696fb9576c3a04ebd5f3650c3f5c4ce9c",
      "role": "electron-runtime",
      "packageExpectation": "included-in-asar"
    },
    {
      "sourcePath": "electron/main.cjs",
      "bytes": 42879,
      "sha256": "01e1bbbaa0c5ac2154d3b66eea360f5c62eb53cfcc89b8e96fc885cca18b6fef",
      "role": "electron-runtime",
      "packageExpectation": "included-in-asar"
    },
    {
      "sourcePath": "electron/path-bootstrap.cjs",
      "bytes": 16043,
      "sha256": "7f0071a0be15e8f0d82291703a5d6621db6f39870fbabe246e115082261b67bd",
      "role": "electron-runtime",
      "packageExpectation": "included-in-asar"
    },
    {
      "sourcePath": "electron/preload.cjs",
      "bytes": 2586,
      "sha256": "e201976c91539242837cad4e7fd5e35c656258aca95643955ac8c58720944b14",
      "role": "electron-runtime",
      "packageExpectation": "included-in-asar"
    },
    {
      "sourcePath": "electron/service-supervisor.cjs",
      "bytes": 7122,
      "sha256": "8c9b1b5fafce61c5869cb8efec10775b12dd8a0bcc3d9863ac7cb403d8294284",
      "role": "electron-runtime",
      "packageExpectation": "included-in-asar"
    },
    {
      "sourcePath": "electron/user-data-migration.cjs",
      "bytes": 1385,
      "sha256": "9c9e51e2b5b6bb8123c73a449ebed0c20de8830779e646e46b6ebdff4c53e4c4",
      "role": "electron-runtime",
      "packageExpectation": "included-in-asar"
    },
    {
      "sourcePath": "src/agent.ts",
      "bytes": 41229,
      "sha256": "5872990a26002684f02aa60b4cc35e1c64076df91c5b0f772ced34d3252e41f5",
      "role": "product-runtime",
      "packageExpectation": "compiled-to-asar"
    },
    {
      "sourcePath": "src/attachment-store.ts",
      "bytes": 11056,
      "sha256": "01e6d1997c3074dff6b69fe0c6c66e6caba4b8bc540cf25248b7ce9c4a9f3823",
      "role": "product-runtime",
      "packageExpectation": "compiled-to-asar"
    },
    {
      "sourcePath": "src/attachment.ts",
      "bytes": 10647,
      "sha256": "659d0b4f264267712b3abcc69d8835b6c0920653d8d19effe82d226996257f54",
      "role": "product-runtime",
      "packageExpectation": "compiled-to-asar"
    },
    {
      "sourcePath": "src/backup-container.ts",
      "bytes": 14509,
      "sha256": "819f1407a89a23d3172ddfd07c58b972c788027314a14dd39ebaeadb944bf518",
      "role": "product-runtime",
      "packageExpectation": "compiled-to-asar"
    },
    {
      "sourcePath": "src/bootstrap-database.ts",
      "bytes": 20195,
      "sha256": "a4ce1c94fe22775f6d309ae2608d8d7f69a181584751d6f36a6a3bdbe7a89de3",
      "role": "product-runtime",
      "packageExpectation": "compiled-to-asar"
    },
    {
      "sourcePath": "src/bootstrap-path-store.ts",
      "bytes": 34606,
      "sha256": "79bb992d4ec5bab8b790337c920b28adebd59d82fe863f8c2f1a2c9327e805f4",
      "role": "product-runtime",
      "packageExpectation": "compiled-to-asar"
    },
    {
      "sourcePath": "src/capability-broker.ts",
      "bytes": 67412,
      "sha256": "a36f7031be1aa04c0921a6d4766a1e4392fca68fb4bbf094b320553b186bb13b",
      "role": "product-runtime",
      "packageExpectation": "compiled-to-asar"
    },
    {
      "sourcePath": "src/config.ts",
      "bytes": 36030,
      "sha256": "26622a3035ad47531d8c2543f2621cc03a358caa82dc314e25a2a028b44134bf",
      "role": "product-runtime",
      "packageExpectation": "compiled-to-asar"
    },
    {
      "sourcePath": "src/credential-store.ts",
      "bytes": 16092,
      "sha256": "d58c86483e73f6b1b470b3caa16a62fb184e5506e5aaa2e74cbf439f225196b5",
      "role": "product-runtime",
      "packageExpectation": "compiled-to-asar"
    },
    {
      "sourcePath": "src/cron.ts",
      "bytes": 8290,
      "sha256": "61d8f6d6732e7c6a4c31b10044193ebedc52b68404dd5b2d55bf869fcd42fd90",
      "role": "product-runtime",
      "packageExpectation": "compiled-to-asar"
    },
    {
      "sourcePath": "src/daemon.ts",
      "bytes": 10407,
      "sha256": "ddf9d8d60660807f41757a3620b431f99573fda211591a9268c8844993a9ee48",
      "role": "source-runtime",
      "packageExpectation": "compiled-to-asar"
    },
    {
      "sourcePath": "src/data-backup.ts",
      "bytes": 6764,
      "sha256": "1e2efda9f06225ef0df3f9cb97a62e8bb158d07d0a6ea465d9d5e335fd153f17",
      "role": "product-runtime",
      "packageExpectation": "compiled-to-asar"
    },
    {
      "sourcePath": "src/db.ts",
      "bytes": 131431,
      "sha256": "1fb311cc78d9c47e4872c3836e9cbb419f93f6c0c370e02c4a2db66d973826b3",
      "role": "product-runtime",
      "packageExpectation": "compiled-to-asar"
    },
    {
      "sourcePath": "src/document-parser-worker.ts",
      "bytes": 784,
      "sha256": "90e6b362f0c354051219eaad36f3864832bcf07769113f5d52533f1780b5f4f5",
      "role": "product-runtime",
      "packageExpectation": "compiled-to-asar"
    },
    {
      "sourcePath": "src/document-parser.ts",
      "bytes": 3617,
      "sha256": "3d29c40948e839f67ba8252a41da09acbe791d07aeb6c7067e5dab4137ff806d",
      "role": "product-runtime",
      "packageExpectation": "compiled-to-asar"
    },
    {
      "sourcePath": "src/embedding.ts",
      "bytes": 6025,
      "sha256": "8df320a74a5fbe7a4fff24cdd6bd3f7ea4b0f38ca3a38d57a07a78f027922b7f",
      "role": "product-runtime",
      "packageExpectation": "compiled-to-asar"
    },
    {
      "sourcePath": "src/event-bus.ts",
      "bytes": 15674,
      "sha256": "840a044878a0324e05dc9ceaef14aad2da4b61eb956a9c6fe29f4a6f5d08d9f5",
      "role": "product-runtime",
      "packageExpectation": "compiled-to-asar"
    },
    {
      "sourcePath": "src/execution-isolation.ts",
      "bytes": 51387,
      "sha256": "83dfdf6e98865acce425a66e8eb0bd4cded8425f2f7e2854334db4c730a28f00",
      "role": "product-runtime",
      "packageExpectation": "compiled-to-asar"
    },
    {
      "sourcePath": "src/execution-native.ts",
      "bytes": 25412,
      "sha256": "4fa8d7600bb79b86e4741aa8952ea4231ce9b6251a553d00c318ea6b97bfcf33",
      "role": "product-runtime",
      "packageExpectation": "compiled-to-asar"
    },
    {
      "sourcePath": "src/execution-network-broker.ts",
      "bytes": 44839,
      "sha256": "cb582c35d0d9cecde47439a95d90f9ece2c28408f33ab3bb446c415183ff39c6",
      "role": "product-runtime",
      "packageExpectation": "compiled-to-asar"
    },
    {
      "sourcePath": "src/execution-runtime.ts",
      "bytes": 38195,
      "sha256": "0264db73364b929b7a3e9de95093798b303cdb6bc81d301b8bfd327f6944e676",
      "role": "product-runtime",
      "packageExpectation": "compiled-to-asar"
    },
    {
      "sourcePath": "src/fetch-runtime.ts",
      "bytes": 10798,
      "sha256": "dd48e262c6cbe2cf395cde2f2278728ebb90a798285bed3b84191732b1143aa9",
      "role": "product-runtime",
      "packageExpectation": "compiled-to-asar"
    },
    {
      "sourcePath": "src/file-viewer.ts",
      "bytes": 25356,
      "sha256": "a9e5385ccf53aee18654fc9870afed1390b1601a6682d9d4dad2067fd4d67fc7",
      "role": "product-runtime",
      "packageExpectation": "compiled-to-asar"
    },
    {
      "sourcePath": "src/index.ts",
      "bytes": 158301,
      "sha256": "66e6dc01044271f687f58748a1bfcdc765539292b1be78cca65fdcc924463e15",
      "role": "product-runtime",
      "packageExpectation": "compiled-to-asar"
    },
    {
      "sourcePath": "src/link.ts",
      "bytes": 5360,
      "sha256": "93fbb6765fb287c2ceb5565e56855eae8c6556780d45b60a4542a2d247ccad3c",
      "role": "product-runtime",
      "packageExpectation": "compiled-to-asar"
    },
    {
      "sourcePath": "src/llm.ts",
      "bytes": 13520,
      "sha256": "cc9d812aa34fa14006bc951b108da70948452f79b66ed2cd67970d6b82aa2fe2",
      "role": "product-runtime",
      "packageExpectation": "compiled-to-asar"
    },
    {
      "sourcePath": "src/logger.ts",
      "bytes": 2480,
      "sha256": "0f993ae4d425f5733b99b9e238c6105b52eb30df38b6f8ab152b315fc9274885",
      "role": "product-runtime",
      "packageExpectation": "compiled-to-asar"
    },
    {
      "sourcePath": "src/managed-path-store.ts",
      "bytes": 10105,
      "sha256": "cbf3bc90daeefd5e20e699c02652ae211f88819f1458a36bd9fa43c52156167e",
      "role": "product-runtime",
      "packageExpectation": "compiled-to-asar"
    },
    {
      "sourcePath": "src/managed-restore.ts",
      "bytes": 42218,
      "sha256": "46ac473542e4c73d288bf2438bd9c176bbc9ca641b5b5220c833ec6499610404",
      "role": "product-runtime",
      "packageExpectation": "compiled-to-asar"
    },
    {
      "sourcePath": "src/manual-execution-consent.ts",
      "bytes": 18910,
      "sha256": "b1e108580eeefcc4c14451f9965e7fbcb1d79c2348152fd44e024b8df992fa4a",
      "role": "product-runtime",
      "packageExpectation": "compiled-to-asar"
    },
    {
      "sourcePath": "src/memory.ts",
      "bytes": 13484,
      "sha256": "315a651afba2de55f39c3af1ea9b7cf1967f8a1aa1cb1615aa79bdb3cd44da03",
      "role": "product-runtime",
      "packageExpectation": "compiled-to-asar"
    },
    {
      "sourcePath": "src/native-process-consent-transport.ts",
      "bytes": 20260,